{
  "UBLEntity": "urn:oasis:names:specification:ubl:schema:json:TransportProgressStatus-2",
  "UBLVersionID": "2.1",
  "ID": "TPSR_1",
  "IssueDate": "2011-10-03",
  "IssueTime": "14:30:10+01:00",
  "StatusAvailableIndicator": true,
  "SenderParty": {
    "PartyIdentification": {
      "ID": "4058673821325"
    },
    "PartyName": {
      "Name": "ARRIVA"
    },
    "Contact": {
      "Name": "SomeName",
      "Telephone": "+49450557888",
      "ElectronicMail": "SomeName@arriva.de"
    }
  },
  "ReceiverParty": {
    "PartyIdentification": {
      "ID": "4058673827641"
    },
    "PartyName": {
      "Name": "NECOSS"
    },
    "Contact": {
      "Name": "SomeName",
      "Telephone": "+49450557000",
      "ElectronicMail": "SomeName@necoss.de"
    }
  },
  "SourceIssuerParty": {
    "PartyIdentification": {
      "ID": "4058673821325"
    },
    "PartyName": {
      "Name": "ARRIVA"
    },
    "Contact": {
      "Name": "SomeName",
      "Telephone": "+49450557888",
      "ElectronicMail": "SomeName@arriva.de"
    }
  },
  "TransportProgressStatusRequestDocumentReference": {
    "ID": "TPS_1"
  },
  "TransportMeans": {
    "JourneyID": "RHamBrem",
    "RegistrationNationalityID": "DE",
    "TransportMeansTypeCode": "230",
    "RailTransport": {
      "TrainID": "RID01235"
    }
  },
  "TransportSchedule": {
    "SequenceNumeric": 1,
    "ReliabilityPercent": 80,
    "StatusLocation": {
      "LocationTypeCode": "13",
      "Address": {
        "ID": "4568763527610",
        "StreetName": "Ludwig-Erhard-Str. 15",
        "CityName": "Bremen",
        "Country": {
          "IdentificationCode": "DE"
        }
      }
    },
    "EstimatedArrivalTransportEvent": {
      "Period": {
        "StartDate": "2011-10-03",
        "StartTime": "18:30:10+01:00",
        "EndDate": "2011-10-03",
        "EndTime": "18:35:10+01:00"
      }
    }
  }
}
